{
  "$schema": "http://json-schema.org/draft-07/schema#",
  "$id": "https://example.com/euro-edge-continuum/partner.schema.json",
  "title": "Partner",
  "description": "An actor in the European edge & MEC continuum.",
  "type": "object",
  "additionalProperties": false,
  "required": ["slug", "name", "cluster", "layer", "country", "tag", "lede", "facts"],
  "properties": {
    "slug": { "type": "string", "pattern": "^[a-z0-9-]+$", "description": "Unique id; file name without .json (a-z, 0-9, hyphen)." },
    "name": { "type": "string", "minLength": 1, "description": "Display name of the organisation or project." },
    "cluster": {
      "type": "string",
      "enum": ["telco", "platform", "orch", "hardware", "infra", "std"],
      "description": "Role: telco=MEC & Telco Edge, platform=Edge Software Platforms, orch=Cloud-Native & Orchestration, hardware=Edge Hardware & Silicon, infra=Cloud & Sovereign Infra, std=Standards & Initiatives."
    },
    "layer": { "type": "integer", "minimum": 1, "maximum": 4,
      "description": "Continuum position: 1=Regional/Sovereign Cloud, 2=Edge Cloud (Aggregation), 3=Access/Network Edge (MEC), 4=Device/Far Edge." },
    "country": { "type": "string", "description": "Country/region code, e.g. DE, FR, EU, INT." },
    "tag": { "type": "string", "description": "Short label, e.g. 'CNCF' or 'DE - Rancher' (~22 chars max)." },
    "lede": { "type": "string", "description": "One sentence shown in the tooltip and as the intro." },
    "facts": { "type": "array", "minItems": 1, "items": { "type": "string" },
      "description": "2-4 concise bullet points in your own words." },
    "link": { "type": "string", "description": "Official URL (optional)." },
    "logo": { "type": "string", "description": "Optional logo path, e.g. logos/<slug>.svg. If omitted, a file named logos/<slug>.* is auto-detected; otherwise a monogram is shown." }
  }
}
