{
  "slug": "sap",
  "name": "SAP",
  "cluster": "orch",
  "layer": 1,
  "country": "DE",
  "tag": "DE - Delos Cloud",
  "lede": "Enterprise-software leader and IPCEI-CIS partner with its own sovereignty cloud.",
  "facts": [
    "A direct IPCEI-CIS project partner.",
    "Runs Delos Cloud (on Microsoft technology) as a sovereign cloud for German public administration."
  ],
  "link": "https://www.sap.com"
}
